# name: test/sql/cityparquet_reconcile.test
# description: cityparquet_reconcile — re-derive feature_id, hierarchy, bbox
# group: [sql]

require cityjson

statement ok
CREATE SCHEMA ams;

statement ok
CREATE TABLE ams.building AS
  SELECT * FROM read_cityjsonseq('test/data/delft_subset.city.jsonl');

statement ok
PRAGMA cityparquet_init('ams');

# Reconciling an already-correct package changes feature_id/children/children_roles
# nothing at all.
statement ok
CREATE TABLE before AS SELECT id, feature_id, children, children_roles, bbox FROM ams.building;

statement ok
PRAGMA cityparquet_reconcile('ams');

query I
SELECT COUNT(*) FROM before b JOIN ams.building a USING (id)
WHERE a.feature_id IS DISTINCT FROM b.feature_id
   OR a.children IS DISTINCT FROM b.children
   OR a.children_roles IS DISTINCT FROM b.children_roles;
----
0

# bbox itself can legitimately narrow. The reader unions in the source's declared
# per-object extent on top of the geometry-derived one (never substituting it --
# a declared extent is not guaranteed to contain its geometry), but
# cityparquet_reconcile's own contract is a pure recompute from stored geometry --
# it has no declared extent to consult, and must be able to shrink a stale bbox
# back down after an in-place geometry UPDATE (docs/FUNCTIONS.md). So reconciling
# a freshly-read package narrows any row whose source declared extent exceeded its
# geometry, and the invariant that holds is containment, not identity: reconcile's
# result is always inside what the reader produced, never outside it.
query I
SELECT COUNT(*) FROM before b JOIN ams.building a USING (id)
WHERE a.bbox.xmin < b.bbox.xmin OR a.bbox.ymin < b.bbox.ymin OR a.bbox.zmin < b.bbox.zmin
   OR a.bbox.xmax > b.bbox.xmax OR a.bbox.ymax > b.bbox.ymax OR a.bbox.zmax > b.bbox.zmax;
----
0

# The union is real: a parent Building whose 3D detail lives on its BuildingPart
# has a bbox taller than its own LoD0 footprint. Before the reader was fixed this
# was flat (zmin == zmax), which made pruning on a parent's bbox silently miss
# buildings — the normal 3DBAG shape.
query I
SELECT COUNT(*) FROM ams.building WHERE parents IS NULL AND bbox.zmax > bbox.zmin;
----
10

# feature_id: a child is re-pointed at its root parent.
statement ok
UPDATE ams.building SET feature_id = 'wrong'
  WHERE id = 'NL.IMBAG.Pand.0503100000012869-0';

statement ok
PRAGMA cityparquet_reconcile('ams');

query T
SELECT feature_id FROM ams.building WHERE id = 'NL.IMBAG.Pand.0503100000012869-0';
----
NL.IMBAG.Pand.0503100000012869

# Every root object's feature_id equals its own id.
query I
SELECT COUNT(*) FROM ams.building WHERE parents IS NULL AND feature_id <> id;
----
0

# hierarchy: a cleared children array is rebuilt from the child's parents array.
statement ok
UPDATE ams.building SET children = NULL
  WHERE id = 'NL.IMBAG.Pand.0503100000016459';

statement ok
PRAGMA cityparquet_reconcile('ams');

query T
SELECT children FROM ams.building WHERE id = 'NL.IMBAG.Pand.0503100000016459';
----
[NL.IMBAG.Pand.0503100000016459-0]

# hierarchy: a child reference to an object that is not really a child is removed.
statement ok
UPDATE ams.building
  SET children = ['NL.IMBAG.Pand.0503100000012869-0', 'bogus']
  WHERE id = 'NL.IMBAG.Pand.0503100000012869';

statement ok
PRAGMA cityparquet_reconcile('ams');

query T
SELECT children FROM ams.building WHERE id = 'NL.IMBAG.Pand.0503100000012869';
----
[NL.IMBAG.Pand.0503100000012869-0]

# bbox: a corrupted extent is recomputed from geometry.
statement ok
UPDATE ams.building
  SET bbox = {'xmin': 0.0, 'ymin': 0.0, 'zmin': 0.0, 'xmax': 0.0, 'ymax': 0.0, 'zmax': 0.0}
  WHERE id = 'NL.IMBAG.Pand.0503100000005156-0';

statement ok
PRAGMA cityparquet_reconcile('ams');

query I
SELECT bbox.zmax > 1 FROM ams.building WHERE id = 'NL.IMBAG.Pand.0503100000005156-0';
----
true

# bbox is unioned across descendants: every parent contains its child.
query I
SELECT COUNT(*) FROM ams.building p
JOIN ams.building c ON c.id = p.children[1]
WHERE p.bbox.zmax < c.bbox.zmax
   OR p.bbox.zmin > c.bbox.zmin
   OR p.bbox.xmin > c.bbox.xmin
   OR p.bbox.xmax < c.bbox.xmax;
----
0

# After reconcile the package validates clean.
statement ok
PRAGMA cityparquet_validate('ams');

query I
SELECT COUNT(*) FROM cityparquet_validation WHERE severity = 'error';
----
0

# checks = restricts what is re-derived.
statement ok
UPDATE ams.building SET feature_id = 'wrong'
  WHERE id = 'NL.IMBAG.Pand.0503100000012869-0';

statement ok
PRAGMA cityparquet_reconcile('ams', checks = ['bbox']);

query T
SELECT feature_id FROM ams.building WHERE id = 'NL.IMBAG.Pand.0503100000012869-0';
----
wrong

# The _sql twin returns text and mutates nothing.
query I
SELECT cityparquet_reconcile_sql('ams') LIKE '%UPDATE%';
----
true

query T
SELECT feature_id FROM ams.building WHERE id = 'NL.IMBAG.Pand.0503100000012869-0';
----
wrong

# --- regressions from the 2026-07-26 review --------------------------------

# An object with several parents takes the root of its FIRST parent chain.
# Recursing through every parent reaches several roots and lets the UPDATE pick
# arbitrarily, making feature_id depend on join order.
statement ok
CREATE SCHEMA multi;

statement ok
CREATE TABLE multi.building (id VARCHAR, feature_id VARCHAR, object_type VARCHAR,
  parents VARCHAR[], children VARCHAR[], children_roles VARCHAR[],
  bbox STRUCT(xmin DOUBLE, ymin DOUBLE, zmin DOUBLE, xmax DOUBLE, ymax DOUBLE, zmax DOUBLE));

statement ok
INSERT INTO multi.building VALUES
  ('r1', 'r1', 'Building', NULL, NULL, NULL, NULL),
  ('r2', 'r2', 'Building', NULL, NULL, NULL, NULL),
  ('c',  'x',  'BuildingPart', ['r1','r2'], NULL, NULL, NULL);

statement ok
PRAGMA cityparquet_init('multi');

statement ok
PRAGMA cityparquet_reconcile('multi', checks = ['feature_id']);

query T
SELECT feature_id FROM multi.building WHERE id = 'c';
----
r1
